Shopify Product Handle,Review Creation Date,Review Content,Review Score,Review Title,Reviewer Display Name,Reviewer Email,Publish Review
oil-of-oregano,2018-01-19,This will knock your cold right out.  Follow up with a good probiotic.,5,Great first line of defense for colds,Daily Psalms,example@example.com,TRUE
oil-of-oregano,2019-08-13,candida cleanse,5,great product for candida,sherrie,example@example.com,TRUE
oil-of-oregano,2018-12-10,Work well for me when I’m sick,5,Oregano pills,EA,example@example.com,TRUE
oil-of-oregano,2016-12-02,love it i feel great... hope this has something to do with it... love the taste... and very easy to take...,5,love it i feel great,D. L. Coulter,example@example.com,TRUE
oil-of-oregano,2015-07-14,This is the only brand oregano oil supplement that controls my cystic acne. No flare ups. When i dont take these or try a different brand it gets out of control. Great product.,5,Excellent supplement.,sh,example@example.com,TRUE
oil-of-oregano,2019-07-07,Great product.,5,Great product.,Milos,example@example.com,TRUE
oil-of-oregano,2015-11-22,As soon as I suspect a cold coming on I take these as per bottle instructions. Kicks that cold in the fanny before it has a chance to accelerate.,5,Kicks a cold fast,Kristina Montes,example@example.com,TRUE
oil-of-oregano,2018-06-27,Great timing for my detox. Thank you very much.,5,Five Stars,joyce,example@example.com,TRUE
oil-of-oregano,2016-12-27,I had it first in liquid form a juice bar.  Next the capsule.  Both work great try it.,5,Both work great try it,diane,example@example.com,TRUE
oil-of-oregano,2019-06-01,Works very well,5,Works very well,Marcusol,example@example.com,TRUE
oil-of-oregano,2015-06-15,I've bought this product several times.  I use it at the start of feeling sick so I like to have on hand when needed.  It was recommended by my homeopath.,5,I use it at the start of feeling sick so I like to have on hand when needed,Shanna,example@example.com,TRUE
oil-of-oregano,2017-06-09,This is a must have for your personal medicine cabinet...safer and more effective than anti biotics.,5,Five Stars,Jan W.,example@example.com,TRUE
oil-of-oregano,2019-04-27,Love this product,5,A+,rrranch,example@example.com,TRUE
oil-of-oregano,2016-02-12,Quite amazing.  Had a cold which wouldn't leave...  in two days the Oregano essential oil had me feeling like myself again.  Highly recommended.,5,Almost Magical,Seven,example@example.com,TRUE
oil-of-oregano,2016-10-25,Works great ! I  use instead  of  antibiotics  and it works ! Very  pleased .,5,Works great! I use instead of antibiotics and it works,Amazon Customer,example@example.com,TRUE
oil-of-oregano,2018-03-06,The capsules were filled with a viscous dark liquid that did not resemble any oils of oregano I have used in the past. Either the product was expired contaminated or counterfit. The product was delivered in the summer and I live in Fresno so the 103 degree temperature may have damaged it in transit. Half of the supplements/oils I have ordered have shipped via Prime Fresh and been in refrigerated bags and half not. I will be more careful ordering things that may be heat sensitive in case this was the issue. I wouldn't order from this manufacturer again all the same.,1,The capsules were filled with a viscous dark liquid that ...,Alison Victoria,example@example.com,TRUE
oil-of-oregano,2019-02-20,Easy to swallow capsule,5,Appears to be a ggod product.,flixfan,example@example.com,TRUE
oil-of-oregano,2017-06-10,Cleared up a planters wart in a week after all other treatments failed!  Miracle!,5,Five Stars,MJ,example@example.com,TRUE
oil-of-oregano,2015-12-28,I bought this to help treat gut dysbiosis and it did a great job. I love how clean this supplement is and continue to buy it.,5,Great for Gut Dysbiosis,AJ,example@example.com,TRUE
oil-of-oregano,2019-06-15,Great,5,Thanks,Mrs. Gibby,example@example.com,TRUE
oil-of-oregano,2019-01-10,My winter go to,5,Love this,Leesa Sparks,example@example.com,TRUE
oil-of-oregano,2015-10-12,It feels like it's killing every germ it sees but actually I'm not sure what it does.,4,I like it,Ken P,example@example.com,TRUE
oil-of-oregano,2015-04-19,love this! i have used a different brand and this stuff works!  worth the extra money to get real quality that works! has helped know out my sinus infections.,5,love this! i have used a different brand and ...,Amazon Customer,example@example.com,TRUE
oil-of-oregano,2019-02-28,Very potent vitamins,5,Awesome for purification,Abby B.,example@example.com,TRUE
oil-of-oregano,2016-03-05,I've been taking these for a year and haven't had a sinus infection yet. I usually get 1-3 horrible Infections a year.,5,I usually get 1-3 horrible Infections a year,Scott  Distefano,example@example.com,TRUE
oil-of-oregano,2015-01-11,I pop these when I feel a sore throat or cold coming on.  Works every time!  I love capsule form because the liquid is too strong even when diluted.,5,Keeps colds at bay!,Jaclyn,example@example.com,TRUE
oil-of-oregano,2018-01-17,Took off an ugly wart off my neck!,5,Five Stars,Soorya,example@example.com,TRUE
oil-of-oregano,2019-05-08,I ended up returning these because as soon as I began taking them I started to feel very ill. After doing a little more research I realized that when taking oil of oregano you also want to be taking an iron supplement as oil of oregano makes it harder for your body to absorb iron. So after I read that I realized that my iron levels were low and that’s why I was feeling so fatigued and sickly.,1,Made my Iron Levels Too Low,Renee,example@example.com,TRUE
oil-of-oregano,2015-05-23,Gaia oregano caps are the best I have found. One a day routine is great for relieving nagging aches and pains. Also a major plus for colds.,5,Gaia oregano caps are the best I have found,CR,example@example.com,TRUE
oil-of-oregano,2018-03-02,Great antibacterial during cold and flu season.,5,Five Stars,Cherokee Woman,example@example.com,TRUE
oil-of-oregano,2018-12-16,Good quality,5,Potent,Alexander Shulzhenko,example@example.com,TRUE
oil-of-oregano,2015-07-30,I always keep oregano oil in the pantry. Anytime I feel a cold coming on I take 2 and it usually knocks it right out.,5,Prevents colds,jennifer griffin,example@example.com,TRUE
oil-of-oregano,2018-03-13,Amazing! Cleared my sinus infection in 2 days!,5,Five Stars,Abigail Frazer,example@example.com,TRUE
oil-of-oregano,2018-10-08,I love these vitamins,5,the best immune system boosting vitamins,Tyler,example@example.com,TRUE
oil-of-oregano,2015-11-01,I like Gaia products and their Oil of Oregano tablets don't let me down.,4,Four Stars,taipan,example@example.com,TRUE
oil-of-oregano,2019-03-09,Amazing,5,Amazing,Joey,example@example.com,TRUE
oil-of-oregano,2015-02-05,anytime I feel like i am coming down with a stomach ache ( as in viral flu) this knocks it OUT!!! mother nature at its best !!!,5,anytime I feel like i am coming down with a stomach ache ( ...,memyselfandI,example@example.com,TRUE
oil-of-oregano,2016-03-31,don't mind the after taste of oregano - not bad,4,Four Stars,LindaBee,example@example.com,TRUE
oil-of-oregano,2018-01-16,Def take with food and lots of water!,5,Super strong,JAMason,example@example.com,TRUE
oil-of-oregano,2015-03-13,This stuff is the BEST!! I can't say enough good things about oil of oregano. It has kept me from getting sick countless times. LOVE this product.,5,This stuff is the BEST!! I can't say enough good things about ...,michelle Haugh,example@example.com,TRUE
oil-of-oregano,2018-04-26,Wonderful product of top notch quality.,5,Five Stars,JK,example@example.com,TRUE
oil-of-oregano,2018-10-28,good health,5,Works well,Amazon Customer,example@example.com,TRUE
oil-of-oregano,2018-03-14,No complaints! This product is great.,5,This product is great.,DRGM,example@example.com,TRUE
oil-of-oregano,2016-12-02,good product,4,Four Stars,teto1904,example@example.com,TRUE
oil-of-oregano,2017-11-29,I'm not sure this really works because I have gotten sick while taken it.,3,Three Stars,william s.,example@example.com,TRUE
oil-of-oregano,2022-01-25,I did not notice any change at all I have much better experience with puritans pride oregano.,1,Not worth the money,Amazon Customer,example@example.com,TRUE
oil-of-oregano,2017-12-18,Great relief for IBS symptoms.,5,Oil of Oregano - it's not Italian seasoning,Mr. Consumer,example@example.com,TRUE
oil-of-oregano,2016-07-28,Love this product. It is a healing accelerator and very useful when on a road trip,5,Five Stars,Kindle Customer,example@example.com,TRUE
oil-of-oregano,2016-11-08,no after test is great. I tried another product and it was really bad.,5,Five Stars,Amazon Customer,example@example.com,TRUE
oil-of-oregano,2017-12-29,Gaia herb products are the best,5,Five Stars,Mary,example@example.com,TRUE
oil-of-oregano,2017-11-07,Love this supplement works sooo well.,5,Just as described,The One,example@example.com,TRUE
oil-of-oregano,2016-04-30,Amazing for curing a  yeast infection within days.,5,Amazing for curing a yeast infection within days,Other Than,example@example.com,TRUE
oil-of-oregano,2015-04-28,One of my arsenal against candida... keeping it in check.,4,Four Stars,carolf,example@example.com,TRUE
oil-of-oregano,2017-06-21,Good for bacterial and fungal issues.,5,reliable,Honest Consumer,example@example.com,TRUE
oil-of-oregano,2018-04-15,Great natural antibiotic!,5,Five Stars,Amazon Customer,example@example.com,TRUE
oil-of-oregano,2015-07-10,Great theraputic brand of an essential nutrient to fight bacteria and fungus infections in the body.  Recommended by our Homeopathic.,5,Great theraputic brand of an essential nutrient to fight bacteria ...,Chrystal,example@example.com,TRUE
oil-of-oregano,2016-12-02,The stuff is incredible I buy it every chance I get,5,Buy this,big rob,example@example.com,TRUE
oil-of-oregano,2019-08-13,I was referred to this brand specifically for SIBO but after I got them realized the capsules were not enteric. so do not offer delayed release.,2,NOT enteric capsules,Linda E.,example@example.com,TRUE
oil-of-oregano,2019-02-09,I bought a bottle of this product on May 22 2018.  They "Best By" date is 01/21.  A couple of weeks ago I tried to get one out of the bottle and discovered that about 12 of the capsules were stuck to the bottom of the bottle or each other. One or more of the capsules had leaked rending several capsules unusable.,1,Problem with leakage,Elizabeth,example@example.com,TRUE
oil-of-oregano,2017-07-12,As described and promptly shipped.  Thanks!,5,Five Stars,Alpine,example@example.com,TRUE
oil-of-oregano,2017-01-22,This is a staple for me. Helps many different things.,5,Basic staple for me,Smart Shopper,example@example.com,TRUE
oil-of-oregano,2018-01-25,Love this vitamin,5,Five Stars,Katie M,example@example.com,TRUE
oil-of-oregano,2018-04-22,Works great.,5,Five Stars,comesailaway,example@example.com,TRUE
oil-of-oregano,2017-10-27,Very good and effective product.,5,Five Stars,Wilfredo,example@example.com,TRUE
oil-of-oregano,2020-11-02,Received on November 1 2020. These pills are rancid. Thankfully I only took one but it made me sick for 12hrs. I cut one open and it looked and smelled like black motor oil. Disgusting! Going to re-think buying Gaia on Amazon - not sure if it’s authentic.,1,Rancid - might not be authentic,Schulte,example@example.com,TRUE
oil-of-oregano,2017-09-19,Good stuff. Buy it on Amazon!,5,Buy on Amazon.,Jacob B.,example@example.com,TRUE
oil-of-oregano,2017-02-09,Great quality product I will be ordering again. :),5,5 stars,Matthias B.,example@example.com,TRUE
oil-of-oregano,2016-05-22,Great product for helping stop a cold.,4,Great product,ASMung,example@example.com,TRUE
oil-of-oregano,2016-12-31,Can't live without this!  Keeps us healthy and strong!,5,Can't live without this! Keeps us healthy and strong ...,Amazon Customer,example@example.com,TRUE
oil-of-oregano,2017-12-27,GREAT for colds!!!,5,Five Stars,Monique,example@example.com,TRUE
oil-of-oregano,2019-07-31,I had trust in ordering these because of the reviews but after the second order I realized that I got a bad batch. I opened one of the capsules and the oil is black and thick. I don’t think Oregano oil is supposed to look like that. I expect a quality product considering the price I paid for it. will try the Mortar and Mortar brand.,1,Never again,Hot Chocolate.,example@example.com,TRUE
oil-of-oregano,2015-12-17,Don't bite into the capsules or you'll find out just how incredibly potent they really are.,5,Five Stars,Hobby Poppy,example@example.com,TRUE
oil-of-oregano,2017-02-18,Stops colds before they get hold of you.,5,Five Stars,Amazon Customer,example@example.com,TRUE
oil-of-oregano,2017-11-02,Does what it says...,5,Great!,Elizabeth,example@example.com,TRUE
oil-of-oregano,2019-03-05,Helps immune system,3,Immune system,Kindle Customer,example@example.com,TRUE
oil-of-oregano,2015-08-14,when I'm starting to feel sick I take a couple of these and it helps so much.,5,Five Stars,Mel Reb,example@example.com,TRUE
oil-of-oregano,2018-01-16,Quick!!,5,Five Stars,Bobbie dillon,example@example.com,TRUE
oil-of-oregano,2015-06-20,Got the pills for a cough that go away.  Have not been taking then long enough yet.,5,Hope for helping,Janet Owens,example@example.com,TRUE
oil-of-oregano,2016-07-18,This is great for candida works awesome.,5,Five Stars,Medina,example@example.com,TRUE
oil-of-oregano,2016-08-03,Great for immune system. I never get sick.,5,Good stuff,Debra sant,example@example.com,TRUE
oil-of-oregano,2017-05-16,Excellent product prompt delivery!,5,Five Stars,Samantha Arellano,example@example.com,TRUE
oil-of-oregano,2015-07-13,My only complaint is that this give me heartburn and I burp bad tasting oregano for hours.  Otherwise it seems to do the job.,3,Stinky oregano burps,Silvy,example@example.com,TRUE
oil-of-oregano,2015-10-05,Very good,4,Four Stars,Amazon Customer,example@example.com,TRUE
oil-of-oregano,2016-08-24,Much better than oil drops and just as effective,5,Five Stars,barefoot,example@example.com,TRUE
oil-of-oregano,2017-05-31,excellent for immune system,5,excellent,Diane,example@example.com,TRUE
oil-of-oregano,2016-10-22,this is the brand I always use,5,Five Stars,Amazon Customer,example@example.com,TRUE
oil-of-oregano,2017-08-18,Great product,5,Great product,R. L.,example@example.com,TRUE
oil-of-oregano,2015-07-03,I sad to say for me it causes a upset stomach like acid insuggestion the sucks intense and I only took one capsule it's been lasting hours know I had to look up side effects on this product:(it's really turning my tummy in discomfort. Everybody different I'm just to sensitive not knocking the product I wish I had great results but I'm not taking it again was just to much for me I only took one capsule and it really upset my tummy sooo bad:(,1,tummy upset for hours:(,Sparks,example@example.com,TRUE
oil-of-oregano,2018-06-24,Ok,3,Ok,Amazon Customer,example@example.com,TRUE
oil-of-oregano,2017-02-06,GREAT FOR PRE SICKNESS PROTECTION,5,Five Stars,Rodney Dunham,example@example.com,TRUE
oil-of-oregano,2014-12-06,Excellent herb Gaia grows and harvests it's own herbs.  Oil of Oregano is good for viruses.,5,Five Stars,Kennedy,example@example.com,TRUE
oil-of-oregano,2017-03-04,Very happy with purchase,5,Five Stars,Amazon Customer,example@example.com,TRUE
oil-of-oregano,2015-09-29,Capsules contain very potent fresh smelling oreganol oil.Delivered quickly.Would purchase again.,5,Five Stars,Kindle Customer,example@example.com,TRUE
oil-of-oregano,2017-03-14,great product .,5,Five Stars,Bluesky49,example@example.com,TRUE
oil-of-oregano,2017-05-29,Great product.,5,Five Stars,Rhonda,example@example.com,TRUE
oil-of-oregano,2017-01-30,helps with pain,5,Five Stars,leon m herrington,example@example.com,TRUE
oil-of-oregano,2020-10-15,Bought this because it is listed as “100%” certified organic.  The bottle has no such certification nor says it’s organic anywhere.  Seems as though they are false advertising the description on Amazon.,1,Not organic as listed in the description,Jordan Atkins-Loria,example@example.com,TRUE
oil-of-oregano,2017-01-31,Doctor told me to take your guess is as good as mine,3,Three Stars,Spirit of Ulises,example@example.com,TRUE
oil-of-oregano,2017-02-13,love this stuff,5,Five Stars,Amazon Customer,example@example.com,TRUE
oil-of-oregano,2017-02-17,This stuff works,5,Five Stars,Kathy,example@example.com,TRUE
oil-of-oregano,2017-11-04,Didn't notice a difference,3,No difference,Jaime L,example@example.com,TRUE
oil-of-oregano,2016-07-10,My favorite brandbuying for many years,5,Five Stars,Cristina,example@example.com,TRUE
oil-of-oregano,2016-12-10,Works for me,5,Five Stars,Amazon Customer,example@example.com,TRUE
oil-of-oregano,2016-12-01,Good all around,5,Five Stars,DrItaly,example@example.com,TRUE
oil-of-oregano,2015-10-29,Oregano is such a need staple in you medicine cabinet.,5,Five Stars,R M D,example@example.com,TRUE
oil-of-oregano,2016-05-12,Super fast shipping and quality product!,5,Five Stars,Amazon CustomerTarp,example@example.com,TRUE
oil-of-oregano,2017-04-05,Satisfied.,5,No complaints,mak,example@example.com,TRUE
oil-of-oregano,2016-12-12,Best oregano,5,Great price,Heide,example@example.com,TRUE
oil-of-oregano,2021-08-20,This came with no plastic seal on the lid nor an opening coating!!  I’m afraid to use.,1,No safety measures,Amanda L.,example@example.com,TRUE
oil-of-oregano,2016-12-19,Great product,5,Great Product,Cynthia D Khan,example@example.com,TRUE
oil-of-oregano,2016-05-27,Awesome for the immune system!,5,Five Stars,ROSI LUZ,example@example.com,TRUE
oil-of-oregano,2016-11-22,Great product,5,Five Stars,Todd Daniel Mickalowski,example@example.com,TRUE
oil-of-oregano,2016-12-06,great,5,Five Stars,Caroline Burgess,example@example.com,TRUE
oil-of-oregano,2016-09-26,good stuff,5,Five Stars,Jerry Bergstad,example@example.com,TRUE
oil-of-oregano,2016-12-02,Excellent,5,Five Stars,ANTHONY DELEON,example@example.com,TRUE
oil-of-oregano,2016-07-18,good product.. well-crafted...healing,5,Five Stars,Sunyasi,example@example.com,TRUE
oil-of-oregano,2016-05-26,Great product,5,Five Stars,danraoul,example@example.com,TRUE
oil-of-oregano,2015-10-05,Fast delivery. Product was as described.,5,Five Stars,Trista,example@example.com,TRUE
oil-of-oregano,2015-07-23,Gaia Oil of oregano simply the Best.,5,Need it most of my days.,AEdolcevita,example@example.com,TRUE
oil-of-oregano,2015-05-10,I love to use these when feeling sick,5,Five Stars,oilswork,example@example.com,TRUE
oil-of-oregano,2016-01-20,just as described.,5,Five Stars,Amazon Customer,example@example.com,TRUE
oil-of-oregano,2015-11-13,Good company great product,5,Five Stars,Nina S,example@example.com,TRUE
oil-of-oregano,2014-07-18,Good product that does what it's supposed to do.,5,Five Stars,Lynn Vielbaum,example@example.com,TRUE
oil-of-oregano,2015-08-23,Cured my cancer.,5,Five Stars,Kelsey,example@example.com,TRUE
oil-of-oregano,2016-01-09,Works Well!,5,Works Well,Carol A. Briney,example@example.com,TRUE
oil-of-oregano,2015-03-10,Seems to be pretty good.,5,Five Stars,Dave S,example@example.com,TRUE
oil-of-oregano,2015-07-31,Nice Product No Problems,5,Nice,Pam Storey,example@example.com,TRUE
oil-of-oregano,2016-01-13,great!,5,Five Stars,Marie P.,example@example.com,TRUE
oil-of-oregano,2019-04-02,Didnt see no difference on skin. I have psoriasis,2,Sad,Joana,example@example.com,TRUE
oil-of-oregano,2015-08-19,Fantastic quality!,5,Five Stars,Melissa V. Smith RMT,example@example.com,TRUE
oil-of-oregano,2015-05-27,doesn't seem to be of the same quality as my previous orders,3,Three Stars,TM922,example@example.com,TRUE
oil-of-oregano,2019-06-14,This made me cough for awhile and hours later I can still taste it. Feels like I ate spaghetti. People complain about fish oil coming back up. This does the same thing. How did it get so many good reviews? Sending back.,1,Can taste oregano for too long,Evelyn,example@example.com,TRUE
oil-of-oregano,2015-08-18,excellent antiviral,5,Five Stars,pluszhohen,example@example.com,TRUE
oil-of-oregano,2020-08-03,Llego con la tapa rota.Y en donde esta la información de como tomar este producto trae una etiqueta pegada y NO deja leer la información.,1,Un poco desepcionada.,Ana Masso,example@example.com,TRUE
oil-of-oregano,2015-03-27,no problems here,5,Five Stars,Gary Liddiard,example@example.com,TRUE
oil-of-oregano,2015-05-12,Great products!!,5,Great Products!!,Elizabeth,example@example.com,TRUE
oil-of-oregano,2015-12-13,GOOD PRODUCT - IT'S OK,3,Three Stars,Violetta  Green,example@example.com,TRUE
oil-of-oregano,2014-11-23,It really works.,5,Five Stars,Doreen Mandel,example@example.com,TRUE
oil-of-oregano,2014-08-30,five stars,5,Five Stars,joseph paternostro,example@example.com,TRUE
oil-of-oregano,2020-04-07,Somebody made a mistake and sent me a bottle of Gass & Bloating pills instead of the oil of Oregano vigan liquid capsules.I'm not very happy.,1,Wrong item.,Lynn Welch,example@example.com,TRUE
oil-of-oregano,2017-08-24,The product appears old not fresh. I've had better results with putting my Doterra oregano oil into a capsule and taking this capsule. I will not be purchasing this product again nor will I recommend it.When I opened the bottle I could barely smell the oregano scent.,1,Poor quality product,Kindle Customer,example@example.com,TRUE
oil-of-oregano,2020-03-26,Porque me cobra un articulo que no he comprado es la segunda vez q me hacen un cobro de productos que no he solicitado. Me tienen harta,1,Que no cobre algo que no he comprando,Leorfa Maria,example@example.com,TRUE
oil-of-oregano,2020-04-25,Gross. Don’t buy these. Get ones in a softgel form.  These are hard the oil looks black and hardly any oil in them.,1,Don’t buy.,Kari M.,example@example.com,TRUE
oil-of-oregano,2018-11-01,no difference,2,no,Brenda jefferson,example@example.com,TRUE
oil-of-oregano,2019-06-19,This is not Oregono oil taste like tar and gasoline the pills were black and I got sick after consuming them,1,Not Oregono oil,Wedeline pierre,example@example.com,TRUE
oil-of-oregano,2017-04-16,Did not agree with me stopped taking it after 2 weeks,2,Two Stars,Guarddog,example@example.com,TRUE
oil-of-oregano,2020-04-28,Product arrived with broken seal.  Threw it out in dusgust.,1,Bad condition,Big Al,example@example.com,TRUE
oil-of-oregano,2015-11-16,Soy is bad for our health due to estrogen levels. Really sad to learn soy lecithin is used with oregano oil. :(,1,Soy is bad for our health due to estrogen levels,Otb Shopper,example@example.com,TRUE
oil-of-oregano,2019-10-31,This bottle had no seal on it of any kind.,1,Not Sealed,Erik B.,example@example.com,TRUE
oil-of-oregano,2019-05-21,All pills were dried out upon arrival. Sent back for refund.,1,Returned,DUNGHILL,example@example.com,TRUE
oil-of-oregano,2019-10-16,Did absolutely nothing. I question the legitimacy of this product,1,Garbage,Micha S,example@example.com,TRUE
oil-of-oregano,2015-12-24,What can I say? I feel sick when I take it for the first couple hours but then stronger than ever afterwards. Making sure to drink lots of water helps dismiss the nausea big time!I started taking this for a major candida overgrowth problem. My stools were full of candida and I felt tired and a bit weak. I was worried and so started on this along with a couple other supplements. The first night I took it (last Saturday) it seemed to all go to boosting my immune system beyond what I could have imagined. The scratchy throat I had and weaknesses from cold weather disappeared and I proceeded to stay up till 3am that night at a party with NO immune repercussions which amazed me.The next day the nausea started. The good news was that the candida immediately decreased in my stools to the point I could barely see it and once the slight upset stomach subsided I felt more clear and strong in my body than before starting the supplement. By the third day the nausea lessened drinking lots of water and fourth day it was barely noticeable. I took a day off then and that brings us to today when I took it again and had to lay down for a while this morning from the semi sick feeling the oil gives. They say this is the candida die off symptoms. As long as I eat 30 min after taking it and drink tons of water that seems to help. I'm sticking with this for a little while since I'm not working this week and can deal with a little nausea to make my body stronger,4,Taking for Candida. Makes me nauseous but it's working,Julia,example@example.com,TRUE
oil-of-oregano,2018-07-17,product not new its clumped together in the capsule.  not comfortable taking them. want to return.,1,not comfortable taking them,Amazon Customer,example@example.com,TRUE
oil-of-oregano,2016-03-18,Caused gas,2,Two Stars,SMR,example@example.com,TRUE
oil-of-oregano,2019-09-25,Didn't taste good,1,Too high,Keith Collins,example@example.com,TRUE
oil-of-oregano,2019-02-07,Seal was broken upon arrival.,1,Seal was broken upon arrival,Amazon Customer,example@example.com,TRUE
oil-of-oregano,2016-08-08,I get a gassy stomach every time I take it. I usually like gaia products but not this one,1,I usually like gaia products,ARabbit,example@example.com,TRUE
oil-of-oregano,2018-11-28,NO ME LLEGA!!!,1,TRACKING DONDE ESTA?,Esmaragdo,example@example.com,TRUE
