Shopify Product Handle,Review Creation Date,Review Content,Review Score,Review Title,Reviewer Display Name,Reviewer Email,Publish Review
oil-of-oregano,2016-04-13,I've been using Gaia's Oil of Oregano for the last 6 years. I recommend it to all my family and friends. I find that the Gaia brand is the strong potency compared to other brands I tried in the past (trying to save money). I used to buy it at Whole Foods whenever it went on sale but now that I've found it on Amazon I just get it here. It's the cost of Whole Food's sale price.I always get the largest size and it lasts me for a good 3 to 4 months. I share them with my brother. It has really helped with my immune system. I rarely ever get sick and if I do it doesn't last long because I take these. I believe it's the best remedy when I'm sick. In the beginning when I first started taking these it used to make me burp a lot and tasted like pizza. Haha! I'm all about natural remedies. I recommend this over any over-the-counter drugs that have thousands of chemicals that most people don't know what they are let alone pronounce.I'm always highly recommending Gaia's Oil of Oregano (and their other products) to everyone that I feel that I should apply to work for them or at least be a brand ambassador. Haha! I LOVE GAIA!,5,I recommend it to all my family and friends,Lynda Bui,example@example.com,TRUE
oil-of-oregano,2022-01-06,Will order this again in heartbeat,5,Have to take with food.,Jodi Casselman,example@example.com,TRUE
oil-of-oregano,2020-09-26,I started taking this for sinus issues and it is absolutely amazing. It was recommended to me from a family member and I wouldn’t believe it if it didn’t do and help me so much! It really seems to keep me healthy clear of any allergy or sinus issues and also give a little burst of energy. You definitely need to drink a full glass of water with it and make sure you’re hydrated as it does seem like it can dehydrate you if you don’t drink enough water. You may have a slight oregano taste as well after taking the pill but it does go away eventually. Highly recommend.,5,HIGHLY RECOMMEND,Sherrie Bentley,example@example.com,TRUE
oil-of-oregano,2017-09-17,My family has used this product as needed for years and once my daughter goes back to school and flu season approaches I leave it on the counter as a reminder to use it regularly. I have noticed their are oregano products out now with very high % of the key ingredient in oil of oregano but I love that Gaia has its own farm that they can monitor the production of their supplements constantly that these are liquid gel caps because oregano is hard to take otherwise and I believe that there is a benefit to taking a holistic plant supplement that includes a wider range of what is in the plant knowing that there could be a synergistic effect and components of the plant that have beneficial properties but have yet to be researched through standard medical channels. Gaia is a brand that can be trusted and you actually know where the supplements are from. They also create jobs here in the US and it's nice to support that too. I love Gaia oil of oregano and along with the olive leaf extract you can trust that your body is being taken care of...... Love!,5,Gaia is great and so is this product!,Isabelsb,example@example.com,TRUE
oil-of-oregano,2019-03-19,I'm not holistic am not organic I am human and suffer from inflamed intestines and was diagnosed with  chronic bowl obstruction as a result of a accident. With that I'm confident this stuff resolved whatever issues I was having with my guts though some additional dietary restrictions were required. Oil of Oregano in addition to gold milk a drink I make with any non-dairy substitute (I prefer macadamia nut milk) turmeric pepper and cinnamon. It helps with bloating and what comes after the bloating..... I would recommend this to anyone with gut issues ask your doctor first to make sure this is not in conflict with other meds you may be taking. I'm grateful to have found something that actually worked for me.P.S. If you are living with gut issues I feel your pain most days suck figuring out what to eat or not eat sucks but once you find a solution it can be life changing so do not lose hope!,5,THIS STUFF WORKS,THE ENGINEER,example@example.com,TRUE
oil-of-oregano,2021-12-16,Greatly reduced the severity of my IBS flare-ups.,5,Great for IBS,Fraking Cylon,example@example.com,TRUE
oil-of-oregano,2017-08-06,I have tried different brands and different forms of oregano. Gaia Hebs Oil of Oregano capsules (this product you are looking at) I would not say it is a bad product but way overrated. First off in my researching oregano oil I have found that you want a high percentage of Carvacrol. If "Nature's Way" brand of oregano oil has 50 mg of oregano oil which states that is has 75-85% Carvacrol. Yes they tell you right on the front label 75-85% and that is excellent.Gaia says 32 mg of oregano and that is IMO not good or for a better term okay. Not to mention that it is ecologically harvested (going to research what the heck that means now) with a statement (this is what it means to me "this may not be entirely true"). The only reason I bought this brand is because of my stupid research of finding "the best Oregano oil". This brand was higher rating than Natures Way on two websites.I will go back to Nature's Way brand. Especially after what I seen on Frontline (PBS) last night. Long story short "herbal supplements are not regulated. Some supplements do not have any of the herb vitamins or they have bad chemicals in them or way too much. The (PBS) episode of Frontline was first aired 1/19/2016 season 34 episode 9. I wish I would have seen it back then.I want honest answers to questions. Honesty will get my business. I want honest reviews. WHERE IS THE HONESTY!!!?Update: Who is responsible? I just noticed that on this product that the 60 count according to the picture has more oregano ( 64mg ).I purchased the 120 count thinking I was getting a better deal (more bang for my buck). So misleading. Gaia how do you keep your customers?,3,Answer the simple question "How much?,Jeff,example@example.com,TRUE
oil-of-oregano,2019-07-15,Was not that powerful to cure my tonsillitis. For 2 months I and my husband suffered from tonsillitis. Doctors at kaiser were reluctant to prescribe antibiotics. So we tried out this oil. Somewhat it reduced some symptoms of cold but not tonsillitis. At least we had to take antibiotics erythromycin for 5 days and then only everything got cured. As per my experience I think oil of oregano is overly popularized. But yes when you it in am empty stomach it hurts the stomach. According to Ayurveda it says that oregano oil increases pitta or fire which is needed to burn up toxins etc. But if pitta is too much also it is not good. So I think there should be balance. Will I recommend? Not probably. I think cow urine tablets are far better than this.,4,Was not that powerful to cure my tonsillitis,Vi,example@example.com,TRUE
oil-of-oregano,2021-07-09,I take oil of oregano when I feel like I might be sick in the morning. That little tickle in my throat always goes away by morning!! Only the Gaia brand works like this! I always keep a bottle on hand and have told many family & friends about ooo!,5,Great product that always works!,Amazon Customer,example@example.com,TRUE
oil-of-oregano,2021-07-01,This stuff is fantastic. Oregano oil is antimicrobial antifungal anti-inflammatory antiviral etc. Whenever I feel like I'm coming down with a sinus infection or something of that type I just take a couple of these and some Sarepeptase and I'm good to go. It seems to knock out anything really quick.,5,Must have for my medicine cabinet,Julia B.,example@example.com,TRUE
oil-of-oregano,2021-07-20,Dealt with Tinea Versicolor for 15 years. Changing up my diet and skincare routine didn't do much to alleviate the issue. On this stuff for a week and the rash is completely gone. I'm blown away! Try it out.,5,Kills Skin Fungus,Rich Rogers,example@example.com,TRUE
oil-of-oregano,2021-10-25,Works the best in combination with black seed oil! Wonderful immune system booster!,5,Great product!,Olga,example@example.com,TRUE
oil-of-oregano,2016-06-22,I was told by my nurse practitioner that she suspected I have SIBO which is an overgrowth of small intestine bacteria. I did a bunch of reading and saw oil of oregano is a recommended remedy. I clearly had something nasty in my system because within the first week taking the caps I started experiencing Herheimer effects. For those stating severe side effects to oil of oregano.... it's worth reading about die off symptoms and the Herxheimer effect. You will be tempted to stop taking the caps but stick with it because that ended by the second week and I'm in week three of taking them. My stomach pain is gone as well as bloating. I also got a small bit of an itchy rash on my legs which is now gone. I will take the caps for 4 weeks as recommended on the bottle and then stop to let my body rest. I highly recommend this product and urge people to read about die off symptoms so they know to power through. It's more than worth it to kill off whatever nastiness is running through your body!,5,Amazing! Power through die off symptoms!,Amber S.,example@example.com,TRUE
oil-of-oregano,2019-09-18,My daughter suggested I take oregano oil when I complained of UTI symptoms including severe bladder spasms odorous urine backache and bloating.  She suggested 4 caps 3 times/day for a week.  Within 24 hours the spasms subsided about 80%.  Within 48 hours no more spasms at all.  I continued for the whole week and feel great!  Energy back.  No symptoms at all.  BTW...in the middle of the therapy I ran out so ordered more but went to Whole Foods and bought their brand to get by until the Gaia arrived.  In less than 12 hours the spasms returned - the Whole Foods brand wasn't nearly as effective.,5,Da Bomb for UTI,Debra Noe,example@example.com,TRUE
oil-of-oregano,2019-12-15,These have helped me build my immune system over time. I started taking them after experiencing terrible colds back to back.The capsules themselves look strange because you can see the liquid inside. However don’t be turned away be their appearance because they really work! I just recommend taking them with food and water and not doing any sort of exercise for a period after because you may experience some burping.I haven’t gotten sick since starting these and I feel healthier overall. Building your immune system takes time and consistency but I definitely feel these have helped significantly.,5,Natural Immune Support,Denise Bella,example@example.com,TRUE
oil-of-oregano,2021-05-13,This stuff is a life saver. I never go anywhere without it. Trust me if you are someone who hates getting sick or are afraid of food poisoning this is a must have. It's saved me many times.,5,A must have.,Plastic Martyr,example@example.com,TRUE
oil-of-oregano,2019-04-12,I’m absolutely in LOVE with oil of oregano! I had never tried it but always wanted to and I’m so glad I did. Whenever I’m starting to feel a cold coming on I take one pill a day (I don’t even need 2 as it suggests) and I’m pretty much cold-free. I have 3 kids and am also a massage therapist so I come into contact with a lot of people and I didn’t get sick at all this past winter because of these capsules! All I got was a little bit of the sniffles but not a full blown cold like I get every single winter. I swear by these!,5,Great for cold/flu season!,DJ,example@example.com,TRUE
oil-of-oregano,2018-11-26,My doc suggested I take this twice a day until our next visit which is in about 1 1/2 month to clear out some gut bacteria.  I take it during the week and give my body a moment over the weekend.  It makes me gassy.  On the other hand I do notice a difference in my stomach/bowl issues.  Over the weekend I drink lemon water to flush my liver out of any toxins and back on this for Mon - Fri.  It's working better for me that way.  Besides the gas...It's doing what its suppose to do and my hubby is noticing the difference.,4,A little Gassy!,Y. Medina,example@example.com,TRUE
oil-of-oregano,2017-04-18,Gaia oil of oregano pills don't cause me any stomach upset at all.  I started taking them about a week ago.  one capsule twice a day between meals.  on about day three I started to feel tired I guess because the yeast were dying off.  I was tired for 2-3 days and this morning I woke up early and energized.  I am also not craving sweets.  I also didn't even need my cup of tea to wake me up.  I took 2 sips and that's it.  this is a big change for me.  I will take these pills for another few weeks.  the bottle says to take no more than 2-4 weeks and then stop.  I am very satisfied and highly recommend these for people with yeast problems.,5,No stomach upset highly recommend these for people with yeast problems.,annabella,example@example.com,TRUE
oil-of-oregano,2015-01-09,If you suffer from IBS you may find help with this product. Every now and then my IBS will flare up. A friend who is very into natural remedies suggested taking it but make sure it's 100% Oil of Oregano (this one is). I was skeptical but it actually seems to improve my IBS flare ups when I take it for 2 weeks. It's like it resets my digestive system. I never take it longer than 2 weeks due to its natural mild antibiotic properties. (Please if you have an infection don't rely on this speak to your doctor)Do be aware when you take these capsules you will begin burping oregano when it breaks open in your stomach. Not the worst thing to be burping if you love oregano like I do. If you are not fond of oregano you've been warned!,4,IBS Sufferers!,K. Gabel,example@example.com,TRUE
oil-of-oregano,2020-05-12,The Gaia Herbs Oil of Oregano capsule is a very good product. It helps in stopping viruses and other bacteria and fungal infections.  The compliment of the product and my own honey (Wayne's Honeybees) my body is best it been since I was an athlete.  The two are a great combo.  Gaia Herbs and Honey. Two great natural foods.Wayne's Honeybees,5,Enhancing your God given natural body,Lynn Wehner,example@example.com,TRUE
oil-of-oregano,2021-03-09,The capsules are too large,4,The capsules are too large,Ksunshine,example@example.com,TRUE
oil-of-oregano,2019-01-12,I love these Oregano Oil Capsules!  They work amazingly well at keeping my immune system working at its peak.  I take one a day and more if I feel something might be coming on and I haven't gotten sick yet!  This is my third bottle and I have subscribe and save so I won't ever have to be without it.  I also take it for combating yeast infections which I struggled with after taking antibiotics for a surgery.  These are anti-viral anti-fungal and anti-bacterial.  I highly recommend this brand because they are organic and contain no fillers.  Great Product and great company!,5,Amazingly Beneficial Product,Wendy,example@example.com,TRUE
oil-of-oregano,2018-06-06,I have been fighting gastrointestinal problems for years along with lung issues for the past 2 years. I'm pretty sure there is mold in our home which is one reason we're moving. The first day all was normal but the second day I thought I had food poisoning in the middle of the night. BUT the very next day I felt better than I had in a long time. 3rd day in I realized this was getting rid of the toxins in my body. Yes there is burping and stuff but this does work. I've used other oregano products but I Swear by this one and this one only. Who needs antibiotics. This product doesn't harm your body like antibiotics will.,5,I'm pretty sure there is mold in our home which is ...,Janice Knight,example@example.com,TRUE
oil-of-oregano,2017-03-27,This stuff is amazing! After doing some online research I thought it would be good to try when viruses start spreading around work. Literally everyone except me caught the last flu bug. Had read it would also be good for warts (in addition to several other things). So I put some on a piece of gauze for 2 days and the wart is completely gone. My friend was getting ready to go on a trip and still had a cold in spite of running out of her prescription.  I gave her some of my Oil of Oregano and when she flew out 2 days later she was symptom free. So she had me order her a bottle too.  I love finding natural products that save me from a doctors visit and this is it.,5,Better than prescription antibiotics,Whole Living,example@example.com,TRUE
oil-of-oregano,2018-10-29,I was worried that this product would be abrasive to my gut flora. Oregano products sometimes leave my gut flora obliterated too dramatically to where even a strong probiotic doesnt help. The Gaia Oregano capsules I take before eating and I never notice much if I forget to eat actually. I have Gastritis/SIBO and been curing it with these Hawaiin Spirulina/Heathers Tummy Savers/and a little Oregano. Works wonders everyone especially the first two supplements I mentioned Spirulina is a blue green algae that is a super hero in my book but its this Hawaiin 1000mg tablet I found that really does the trick. Still to help kill off the bacteria the oregano is moving the process along.,5,Helps with My Gastritis/SIBO and Gentle on the Stomach,brian,example@example.com,TRUE
oil-of-oregano,2017-11-26,I would highly recommend oil of oregano to almost anyone. This brand specifically. Taking other brands after using this is like comparing apples to oranges.This stuff truly works wonders and oil of oregano has never let me down. Aside from its myriad of other benefits oil of oregano is a miracle hangover cure. Never again suffer from your bad choices with a bottle of oil of oregano at your side!Oil of oregano (if your constitution can handle it) is quite the panacea the only downside is if you are taking it for nausea or an upset stomach be careful to keep it down at all costs as oil of oregano coming back up is just awful.Happy oregano burps!,5,One of nature's great wonders.,WM,example@example.com,TRUE
oil-of-oregano,2019-10-10,I don't like to give reviews before I've tried the product for a while but I feel compelled to let you know you will burp oregano. Haha! The bottle feels like quality packaging. It was well protected. I tasted oregano when taking the capsule and a couple times since. We'll see what if any benefits I feel after a couple weeks/month.,4,Oregano oil,Michelle E.,example@example.com,TRUE
oil-of-oregano,2019-07-25,Gaia is the best of all brands. I made the mistake of running out of my ‘O of O’! Any doubts if it was helping my skin are gone! I’m on Dupixent for Eczema which has helped tremendously!! I continued to have problems of my feet not clearing up due to what Dermatologist calls a form of yeast. After taking ‘O of O’ one capsule twice a day for 6 weeks my feet cleared up! I’ll never run out of Gaia again!,5,Gaia is the BEST natural product.,Shirley,example@example.com,TRUE
oil-of-oregano,2016-04-05,Oil of Oregano is an absolute must have for your natural medicine cabinet. Not only is it antibacterial it is also antifungal and antiviral. It has been known to cure urinary tract infections respiratory infections yeast infections and parasitic infections just to name a few. I have used this whenever I have a cold or soar throat coming on and it helps relieve it so quickly. This is not a long term has product as it does state on the bottle but if you are fighting of a number of infections or bugs it will help you. I love Gaia herbs and although this may be a bit more costly than other oregano oils out there Gaia herbs prides itself on being a sustainable product and are a wonderful company that I highly recommend.,5,Gentle on the Earth Powerful in Your Body,AMH333,example@example.com,TRUE
oil-of-oregano,2020-02-16,This feels like a high quality supplement. I feel better when I take it consistently and I have noticed improvements in chronic bv (after periods) using this silver hydrosol and menstrual cups instead of tampons. I also topically apply this to my eczema to soothe it and speed healing. The smell is quite strong but well worth the healing effects. Solid product!,5,So good!!,Ann Purchas,example@example.com,TRUE
oil-of-oregano,2020-01-19,I love this product for its immunity benefits especially when I am sick or am traveling I have also opened the capsules and mixed with a carrier oil for my skin issues. And also used for oil pulling when I had a cut in my mouth. I always keep it in my cabinet and take it as needed not for ever day use.,5,Great!,courtney,example@example.com,TRUE
oil-of-oregano,2018-11-03,Gaia's Oil of Oregano works! I teach toddlers and every year when the seasons change in spring and especially fall and the snooty sneezy comes out of the woodwork is when I start my 2 week regimens. I have never had a flu shot. I don't care for over-the-counter chemical solutions. Year after year I rely on this brand for supporting my immune response to toddler germs otherwise known as lethal weapons 😊. It bears mentioning that Amazon offers 120 caps at $29 as opposed to $45+ elsewhere. I highly recommend it and will continue using it myself.,5,The finest natural immune booster,alla bevzenko,example@example.com,TRUE
oil-of-oregano,2018-01-21,This product has been a godsend for our family.  Both of my children suffer from autoimmune diseases and have gut issues.  I steer away from antibiotics as much as possible because they will decimate their gut flora.  As soon as I know there is anything even mild brewing (cold sniffles sore throat) I start treating with this.  It has worked like a charm and stops the virus/bacteria illness in its tracks.  I'm a nurse so I'm very careful about what I administer to my children especially with their health issues.  This product is a winner and I always ALWAYS have it on hand!,5,Liquid gold can't live without it!,Laura,example@example.com,TRUE
oil-of-oregano,2018-05-19,I’ve used this product to follow “Jini’s  Guide to Healing Gut Infectioun”  with a recurrent bout of diverticulitis after allopathic antibiotic therapy failed. I recommend getting the e-book and reading it thoroughly before starting therapy as there are contraindications. I am also following her recommendations for specific brand of probiotics not available here on amazon. They are expensive but given my experience with probiotics and her logic for why they fail it made sense. I bought them and don’t regret it!I will be keeping Gaia Herbs Oil of Oregano in my medicine cabinet. I can buy it locally but this was a much better price.,5,Amazing results!,Anonymous,example@example.com,TRUE
oil-of-oregano,2019-10-18,this is my favorite brand for oregano oil and the capsules save my gums. I made the mistake of buying the oil only while on a trip and it caused some sores in my mouth. So now I know and only take it in the capsules.Best natural antibiotic I've found and I take it when I have any kind of infection. It's fantastic.,5,my fave brand of oregano oil,Tess C.,example@example.com,TRUE
oil-of-oregano,2016-09-01,This product is a life saver. A couple of years ago I got very sick to my stomach and I have been working on restoring my health since. When I first got sick I had to take a couple of rounds of antibiotics now I use this natural antibiotic. I will never be without this product. Anytime my stomach starts to bother me I just take one pill a day for a few days and it always feels better. My husband was having a some pain in his tooth not to long ago and the doctor told him it was nothing. I started him on this and within days he said the pain with gone.,5,Anytime my stomach starts to bother me I just take one pill a day for a few days and it always feels better. My husband was havi,Casey W,example@example.com,TRUE
oil-of-oregano,2018-05-09,Have been using this for years whenever I feel a cold or respiratory problems coming. I love the Gaia brand and the oregano capsules are simple to take--occasionally I will have an oregano burp but that is much better than having a full-blown respiratory infection. Usually if I take two capsules at the onset of any symptoms and one capsule three times a day for another day or two I am back to normal. I always have these on hand and have given them to my husband also with similar results. Antibiotic action without the pharmaceutical complications!,5,Always have these on hand,BB,example@example.com,TRUE
oil-of-oregano,2020-01-06,I purchased this product as part of a supplemental cocktail for a natural approach to reduced Candida and biofilm for improved gut health.  I love Gaia brand products as the quality is always reliable so I didn't mind paying more than similar products by other brands especially considering the importance of gut health and microbiome.,5,Great brand high quality!,Dana Anderson,example@example.com,TRUE
oil-of-oregano,2016-07-22,My husband has been ill with a mystery illness and I am pouring on the Oregano oil and he is improving!  Drs. have not been able to identify the illness but I know from my previous experience with MRSA GAIA Oil of Oregano will help!  I fought MRSA with this product and with Silver Nitrate and the combination killed it.  I drowned myself in it - took as much as I could until I could feel it upset my stomach a little and then held at that dose for a couple weeks and it was gone.  My husband's fever has broken and he is improving.  LOVE this product and only GAIA.,5,Only GAIA for me!,Kindle Customer,example@example.com,TRUE
oil-of-oregano,2020-04-11,Oregano oil should be in every medicine cabinet!  High quality oregano is not easy to find!  This oregano oil is superior!  Read all about it give it a try you will agree it is the best thing to always have in your cabinet,5,Should be in every medicine cabinet!,Sue,example@example.com,TRUE
