Shopify Product Handle,Review Creation Date,Review Content,Review Score,Review Title,Reviewer Display Name,Reviewer Email,Publish Review
ashwagandha-root,2022-08-12,I wasn't sure if this was going to work but someone recommended it to me and I had to try it. By the time I took the first capsule I felt it calm my gut. This might also lessen diarrhea because somehow when I take it I don't get diarrhea the next morning. Don't know if that's coincidence or not.Aside from that this improves my thinking and has all natural ingredients. Just the mushroom and vegan capsule.,4,Healthy herbal supplement that might work for gut disorders too,Amazon Customer,example@example.com,TRUE
ashwagandha-root,2022-08-01,I’m not sure if they are working for headaches but I feel really good taking them.  I drink it in the morning on empty stomach,5,Tension headaches,Amazon Customer,example@example.com,TRUE
ashwagandha-root,2022-06-19,I take this to help with ADHD. It seems to help me focus throughout the day.,5,Helps me focus,Nosoupforyou,example@example.com,TRUE
ashwagandha-root,2022-05-26,I have been taking this product for two weeks.  And I can testify that it definitely works.  You will not be disappointed.,5,So Far So Good,Kenrick,example@example.com,TRUE
ashwagandha-root,2022-02-09,Our 12 year old Rhodesian Ridgeback has GOLPP. We started feeding him 1/2 pill with breakfast and are convince it has helped to not only slow the weakening of his nerves but to actually repair some nerve damage. His rear legs are gaining some strength back and he is not chocking as much as he used to. We read that lion's mane can heal nerve damage and we are now convinced that it does.,5,Good for dogs.,Mid-coast Marc,example@example.com,TRUE
ashwagandha-root,2021-07-20,Started taking this 3 weeks ago.  I have tried alot of supplements and these are easy to swallow - the capsules aren't like a horse pill and there is no "bad taste".  My daughter wanted to try them with me but she doesn't like mushrooms.  Neither of could taste mushrooms nor did it have any "earthy" flavor that some people are concerned about.  I have a bit of anxiety and I was looking for something to give me more focus and stronger mental performance.  So far so good!,4,Impressed by it's claims,Kindle Customer,example@example.com,TRUE
ashwagandha-root,2022-02-16,Love the quality and how I felt after taking it for a month.  I continue to use it everyday.,5,Great quality,Tim Gilbert,example@example.com,TRUE
ashwagandha-root,2021-06-16,Recently introduced to the benefits of Lion's Mane Mushroom for brain and nerve support.  Really appreciate that this product is Non-GMO and made with organic mushrooms.  It is a bonus that the supplements are also gluten and grain free.  What makes this a no-brainer (no pun intended) for me is that Gaia screens their products and using a unique code on your product allows the purchaser to review the results of testing for microbes heavy metals pesticides and more.  You can also view the manufacturing date so you know when your product was created and when it will expire.  Love that this company shares this important information!  Earns my trust!,5,Excited about the difference this supplement can make,HK1,example@example.com,TRUE
ashwagandha-root,2022-02-07,I feel like this is helping me feel more alert and has reduced anxiety symptoms. No side effects.,5,Great product,JT,example@example.com,TRUE
ashwagandha-root,2021-07-07,It was easy to swallow. I didn't notice any flavor.  I don't notice a huge difference but I am going to try it for longer and see how it works over time.,4,It is what it is.,Angie Pulvermacher,example@example.com,TRUE
ashwagandha-root,2021-06-17,I have been in search for some "brain food" and this has definitely helped me with clarity of my mind definitely feel more clear or alert in the head. Helped me with overall inflammation. I notice I don't feel so inflamed or stiff in the morning when I wake up. Definitely notice in hands and feet! Good product. Love the entire line of GAIA,5,Actually noticed a difference with this product. GREATEFUL.,Lynda Vander Weit,example@example.com,TRUE
ashwagandha-root,2021-06-10,This is an easy to take odorless supplement. I have been taking the product for 2 weeks and don’t notice a big difference in mental clarity however I know with supplements you sometimes need to take over an extended period to notice a difference. I have noticed that I feel bloated over the last couple of weeks. Don’t want to assign blame to mushroom supplement but want to leave that here in case others notice as well.,3,Would like to notice more of a difference,C. Segress,example@example.com,TRUE
ashwagandha-root,2021-10-28,As advertised.  Pleased with results,5,It works,N. Carroll,example@example.com,TRUE
ashwagandha-root,2022-08-05,I had been wanting to get on Lion’s mane for awhile but kept forgetting/putting it off. (If you know you know how it is with ADHD). I struggle to remember to take things daily sometimes especially multiple times a day but because these capsules are concentrated and only require 1 a day I think that could really help folks with ADHD/people with memory problems. I have been having eye twitching on my left eye socket  for a few months now off and on. I have also been having twitching under my left eye on my cheek. I had gone to acupuncture and that didn’t do much. This can happen to me if I don’t sleep too well but obviously it hasn’t gotten much better and it feels like a very specific part of my body and face. I take vyvanse a few times a week and notice that when it wears off I get muscle twitches. (my eye was still twitching even on my days off from vyvanse). I have been on these capsules for a week and all of it is gone! I had suspected it was dopamine related because I know that dopamine receptors and lack there of can effect this kind of stuff. I’m just shocked it went away so quickly. I recommending this product to all of my friends with ADHD and those who are medicated. I plan on continuing to take it to see if it helps with brain fog memory focus and other ADHD symptoms but so far so good. Only took a few days to notice my first big difference. Truly amazing. Easy to swallow and doesn’t taste bad.,5,Noticeable effects in a week,Sam,example@example.com,TRUE
ashwagandha-root,2022-04-24,It blocks dht. As a woman long story short it lowers estrogen too. So many symptoms of low estrogen. I stopped taking it and took other things to raise it back up and I’m ok now. Still have bald spots but it’s growing back.,1,Hair fell out in patches and clumps,Hamid Qazi,example@example.com,TRUE
ashwagandha-root,2021-06-03,I’ve been taking these a week so far and they are great so far. Easy to swallow and no weird aftertaste. I’ve noticed a difference in my memory and focus so I’m going to make them part of my normal supplement routine.,5,Great supplement,nicole,example@example.com,TRUE
ashwagandha-root,2021-12-18,I said it all above.,5,I take it everyday as part of my vitamin regiment.,Claudia Smith,example@example.com,TRUE
ashwagandha-root,2021-12-13,I've tried many many different lion's mane extracts and whole mushroom supplements over the years. THIS is the one. For me a noticeable neurologic effect within minutes of taking it with my morning coffee. Feels as if I'm giving my brain EXACTLY what it needs to thrive and perform at its best. It costs more than the competition because it's a noticeably higher quality product in my experience. I find Gaia's ashwagandha to also be of excellent quality compared to others I've tried. I would encourage anyone who takes lion's mane to compare this product to whatever it is they are currently taking.,5,My Personal Gold Standard for Lion's Mane Supplements,Brett,example@example.com,TRUE
ashwagandha-root,2022-05-30,These have worked for me.  They take the edge off that foggy head feeling and I can be sharper with my work/ on point.  I tried other popular brands and I picked this one because it does not make me jittery and feels like it holds steady throughout the day versus just right when you take it.  I take one in the AM and one in mid-afternoon.,5,Takes the fogginess away,Silver ZZ,example@example.com,TRUE
oil-of-oregano,2021-06-17,As a happily married woman I must say it’s quite amusing to men that we girls are always getting urinary tract infections (UTI) or at least have a much higher chance of getting it. Well one day my husband came down with it. He finally understands now how we girls feel! And not to be cliché-ish he refused to go to the doctor in the same way how he refused to read the manual to our new washing machine and dryer. Uhh! How do we girls ever put up with men and their machismo. He was experiencing pain in the bladder buttock the two bottom cheeks and his back. These were clear symptoms of UTI and it’s very dangerous. Going to the doctor was not an option for him so I had no choice but to consult the internet for advice and that eventually lead me to Amazon. As a precaution this is not medical advice so please consult your doctor if you or a love one has UTI. To make a long story short we researched and ordered a bunch of herbal pills that he used religiously over a period of 7 to 8 months. For added benefit we asked the real Man (no pun intended) upstairs for help. Herbal pills supplemented with a generous dose of daily prayer to Jesus. Slowly but surely he healed and was cured. Now he has no pain and infection down there and he can confidently hang out with his male friends and boast with great vanity about his masculinity once again “free at last free at last free at last!” Fighting UTI isn’t fun but if herbal medicine is strong enough for a man then it’s good enough for a woman. Here is a list of items for your perusal and research; most of which was bought here on Amazon.• Turmeric Curcumin - 2250mg/d - Veggie Caps - 95% Curcuminoids with Black Pepper Extract (Bioperine) - 750mg Capsules - 100% Organic - Most Powerful Turmeric Supplement with Triphala (180 Count).• Gaia Herbs Oil of Oregano Vegan Liquid Capsules 120 Count - Immune and Intestinal Support for Healthy Digestive Flora.• Ginger Capsules - 90 Kosher Vegan Caps with 1000mg Organic Ginger Root.• Nutricost Goldenseal Root 600mg 120 Capsules - Non-GMO Gluten Free Vegetarian Capsules.• Oregon's Wild Harvest Certified Organic Garlic Capsules Non-GMO 1575 MGS 90 Ct.• AZO Cranberry Urinary Tract Health Dietary Supplement 1 Serving = 1 Glass of Cranberry Juice Sugar Free 100 Count.• D-Mannose 1300 mg with Cranberry Extract Fast-Acting Flush Impurities Natural Urinary Tract Health- 100 Veggie Capsules.• Costco Kirkland Vitamin C tablets 1000mg.• Costco Kirkland Wildflower Honey.• Copious amounts of daily prayer to The Man upstairs.,5,Strong Enough for a Man but Made for a Woman,Cup a Noodles,example@example.com,TRUE
oil-of-oregano,2022-06-06,helped with herpes very well,5,excellent,Kimberlynn Myers,example@example.com,TRUE
oil-of-oregano,2019-05-26,I've had a bug for almost a week consisting of a very aggressive tickle/scratchy throat causing me to cough so much my ribs are sore. I've been drinking a mixture of honey lemon and Bragg Organic Apple Cider Venegar which has soothed the symptoms for the longest intervals. HEB Honey cough drops do well on the road but only for as long as they last in your mouth. This morning in church the scratchy throat was so persistent that I had to line up about 6 cough drops on my leg for easy access while listening to the sermon. The scratchy throat symptom has been very annoying making it even difficult to talk. I was getting concerned that maybe it's time for a doctor visit next week. It seemed to be getting very serious. I had looked online for any natural forms of antibiotics (non-prescription) that might work and customer reviews raved about this Oil of Oregano. So I ordered it from Amazon and it arrived today. I took one after lunch expecting it to take several days before I would notice any possible relief......WITHIN ONE HOUR - I repeat - WITHIN ONE HOUR - for the first time in 4 days my scratchy throat was GONE!!!!!!! I'm in shock folks! I still cough a little bit but not from the scratchy throat sensation. I have a little bug of some kind that feels like a mild cold. But the scratchy throat aspect of my condition is GONE!!!!! This Oil of Oregano is supposed to help your body's natural resistance to crud and it sure worked in a hurry for me! I know this is just after a few hours and symptoms could return. Whatever happens I'll post a follow-up and let you know. As of now I've never in my life seen any supplement get such amazing results! My capsules look like they may have dried up a bit (like another reviewer mentioned) but it apparently still works its magic!,5,AFTER ONE CAPSULE - AMAZING RESULTS!!!!!!,Rick Moore,example@example.com,TRUE
oil-of-oregano,2022-02-19,I pop 2-3 if these per day and squeeze it under my 8yr olds tongue. (old school way) so of course oil of oregano is a harsh tasting substance as a liquid. For me I take them the reg way. No flavor no issue swallowing them. This has been plenty helpful doing the pandemic. No colds no mucus issues.,5,Product that works,Saadiqah Warren,example@example.com,TRUE
oil-of-oregano,2020-11-26,For years I’ve been getting severe sinus and respiratory illnesses every fall that lasted almost into summer even had pneumonia twice. I’m otherwise healthy but felt like I was sick half a year almost. I was prescribed several different antibiotics steroids nebulizers etc. I tried several natural remedies as well but nothing seemed to help until I found oregano oil. While it didn’t completely take away my illness when it was at its worst I could tell it helped. I took it 3 times/day until my health improved then once per day for awhile. I stopped taking it for awhile but as soon as I feel congested or start getting a sore throat I’ll start taking this and it’s gone the next day. I also add olive leaf extract sometimes and take elderberry zinc and vitamin c and d almost daily (I was taking those in the past and still got sick). This fall and winter I’ve been the healthiest I can remember in a long time. I work in the OR so I’m around patients and other people constantly. Even though we wear masks all the time some of my coworkers have gotten Covid. Not sure if it’s just luck or the addition of this product that has kept me healthy. I’ll keep this in my medicine cabinet from now on.,5,Great immunity booster,Momma shops a lot,example@example.com,TRUE
oil-of-oregano,2021-04-23,Ok so I’m not sure where to begin but I have been struggling with Candida overgrowth (yeast) throughout my body for months after antibiotic use last summer. Probiotics have helped a ton and so did the Candida diet. I still had symptoms popping up from time to time including chills yeast infections headaches severe fatigue UTIs you name it. I reread my medical medium books and I decided to do his Anti-Bug cleanse and incorporate lemon balm and celery juice daily which yes seemed to help a lot but my girlie issues persisted. I purchased this product in the middle of a bad flare up. After the first pill I felt a bit dizzy but I took another one that night because I am very aware of die off symptoms. By the next morning though I had felt a huge shift in my health and energy levels. I am continuing taking these twice a day and I can feel improvement each time. I will update this review once I have completed my two week cycle but the way it’s looking right now this is the Holy Grail for Candida/yeast infections!,5,Curing Chronic Candida/Yeast,AuntieCoco,example@example.com,TRUE
oil-of-oregano,2020-11-14,I have thyroid disease. One day I woke up super bloated. Nothing helped. Doctors couldn't figure it out after lots of tests. So I put the pieces together along with extensive research and pretty sure I got SIBO. Since Covid is going on I don't wanna risk visiting any doctors offices right now to deal with this. I read Oil of Oregano can help. So I changed my probiotic to Saccharomyces boulardii and started taking that with this Oil of Oregano. I also did a low fodmap diet as best as I could. When I took this Oil of Oregano I didn't need my allergy medicine which was a nice benefit. I stopped taking it after 4 weeks because it's not good to take it long-term daily. It made SIBO bearable and allowed me to eat a little. It's not a cure for SIBO as SIBO is hard to get rid of but it helped me at least for a month. Good stuff. If you have SIBO there are other things needed but I also recommend a digestive enzyme going gluten free and stay away from sugar carbs and histamine foods.,5,Help with SIBO,Customer,example@example.com,TRUE
oil-of-oregano,2020-08-12,I took this for years of mold exposure and my doctors being chuckle heads dealing with it. My hair fell out in clumps a persistent 3 years long cough  stomach/ bowel distress. Eventually I had to stop working full time. Once my water tested positive for light traces of mold  I took this.Cons: I only lasted 4 days before my BPM dropped to 48 and it triggered headaches and heart palpitations from low heart rate. I've read it can lower absorption of iron zinc and something else. So if you're on the line like me taking it as directed could be too much.Pros: within the first day so much was coming out of my body. It was gross but necessary. Sweat mucus  toilet strips. I coughed out so much. I am breathing so much better now. I don't need my inhaler through the day like before. My sinuses are less stuffed.My concern is how powerful it is. Listen to your body and give your body a break if needed. The bottle instructs 2 pills a day 2-4 weeks... I could barely go 4 days one pill.,4,POWERFUL be CAREFUL,Christina Hill,example@example.com,TRUE
oil-of-oregano,2022-03-11,It’s great for you specially with all of the things going on in the world,5,Oil,Yaw,example@example.com,TRUE
oil-of-oregano,2019-05-31,This stuff has kept me out of the hospital time and time again. I use it for anything problem that needs an antibiotic. This is natural and helps with king problems. I am pretty sure I had pneumonia twice and I just kept taking this along with black seed oil. The next day I was 50% better. I was so scared. I could hear the fluid gurgling when I was breathed and my breaths sounded like a truck. Towards the end of the night (of the next day) I was perfectly fine. I couldn't believe it. I had my stuff packed to go to the hospital and everything. I took a chance that many wouldn't understand but I trust my instincts.Don't take it for more than a month at a time and DO NOT EAT WITH FOOD!!!!!!!!!!!! I can't stress that enough! I made that mistake once and I will never forget it. If you want to know how to take it. Take it every 12 hours in between meals which means if you want to eat... Take it on an empty stomach and then wait an hour to eat. If you've already eaten... wait 2 hours to take it. This stuff is amazing to me. It helped clear up the fluid in my ear and irritation from my contact lenses as well. I love the Gaia brand!,5,Natural Antibiotic,Packie Tills,example@example.com,TRUE
oil-of-oregano,2021-07-03,Easy to swallow however I have in the past made my own capsules with a bottle of oregano oil and empty gel capsules and have not had any of the oregano flavor that way. These I have to try to keep from touching my tongue when I take them because the flavor does come through the capsule a bit. Effective but you ultimately have to decide if you’re willing to deal with a moment of unpleasant flavor.,4,Effective but slightly unpleasant,Sarah R.,example@example.com,TRUE
oil-of-oregano,2022-02-26,I have been taking this product for years and I highly recommend it!,5,FANTASTIC PRODUCT,parent and teacher,example@example.com,TRUE
oil-of-oregano,2021-02-23,This stuff is good to take if you feel like you’re fighting something off especially right away when you feel that. I take it with vitamin C airborne zinc and a couple other oral supplements. I also recommend taking raw garlic in the morning if you feel like you’re coming down with something. Best on a empty stomach. The best way to do it is to crush the garlic with something flat and let it sit there for five minutes before you take it. I mash it till it’s almost a paste (I use the back of a wooden spatula) put it on a spoon and swallow it with water right away so I don’t taste it too much. When you smash it and let it sit it releases all the good chemicals that are antibacterial and antiviral.,5,Good Stuff,Happycat,example@example.com,TRUE
oil-of-oregano,2022-02-09,This particular brand is high quality. I also use the cranberry. Worth the money and easy to swallow.,5,Immune suport,Likes a great deal...,example@example.com,TRUE
oil-of-oregano,2019-09-16,I use this product when I start feeling sick. I can't believe how well it works! I used to take a lot of them multiple times a day when I started feeling sick however I have since learned that they can still kill off your gut bacteria if you overdo it. So now I follow the instructions. Sometimes I can still tell that I'm sick (I may be a little extra tired slight scratchy throat slight stuffy nose) but the symptoms are so minimal they do not affect my everyday life. Some days I have no symptoms at all! This is a lifesaver for me because usually my colds really knock me out and I get sick for at least 2 weeks. With this product I may be sick for a week but like I said I will barely even notice. I'm not a doctor so I can't say to take or not take the dose that I do but I definitely would recommend giving it a go! I also really trust this brand and have tried a few of their products and have been satisfied.,5,Amazing for colds,KB,example@example.com,TRUE
oil-of-oregano,2019-07-28,Read a lot that people are starting to use Oregano oil instead of antibiotics.  Heard it's good to use for a handful of ailments and is a great preventive remedy.  Got some because of my hubby's allergies.  He can't take regular allergy medications because they dry him out so badly he gets bloody noses.  He wakes up every morning choking/puking from the phlegm running down the back of his throat.  Since he started taking this it has decreased about 90%.  There is still some and he has bad mornings sometimes.  But compared to not taking them it's wonderful.  Neither of us is sick frequently to speak to it taking care of illnesses.  We have now gone through 2 bottles and will continue with this product.  It seems effective.  When I put the capsule on my tongue I can taste the oregano after a few seconds.  It smells like the real deal too.  I recommend everyone keep some in your cabinet for those times when you aren't quite right and can feel something coming on.,5,Natural antibiotic,Karen Vint,example@example.com,TRUE
oil-of-oregano,2021-03-28,All I have to say is that I had a sore throat that started Tues evening. I don't know if I was getting the flu or COVID but I had a little left of my oil of oregano in liquid form so I took it.  The next morning I had a flaming headache to the point my eyes we're hurting.  Now I know a few people that had COVID said their eyes hurt.  I took 2 of these and I made a hot tea concoction with a frozen ginger cube honey and a sea moss gel cube. I drank it 3 times that Wed.  By 7pm my illnesses ceased!!! Y'all better get these pills they are the truth! I take them daily now!,5,COVID/FLU KILLER,E Harp,example@example.com,TRUE
oil-of-oregano,2022-01-28,Sure beats going to a doctor. The reviews are on point. No need in me rewriting.,5,Can’t go wrong,Scrappy420,example@example.com,TRUE
oil-of-oregano,2021-12-17,This supplement is great as it works for many things and I have noticed that they are string enough to work for me as I take 2  a day.,5,Great product!,Brandy Stanga,example@example.com,TRUE
oil-of-oregano,2021-08-28,I have taken this supplement for only 3 weeks and I don't see any real change or improvement.  I suppose like all other supplements it requires more time...they will happen.,4,Time will tell,cpsanc,example@example.com,TRUE
oil-of-oregano,2022-01-12,I’ve been using this product for six years after experiencing a heart attack,5,Been taking it for 6 years,Philip Lewis,example@example.com,TRUE
oil-of-oregano,2022-02-05,OK item,5,n/a,Patricia S. Gane,example@example.com,TRUE
oil-of-oregano,2018-09-22,I love... LOVE.. this oil! Most likely the most versitile oil you can get! With all the beautiful benefits of oregano I can't see ANYONE without it Do your research...! Anti-viral anti -bacterial anti-fungal anti-oxidant anti-inflammatory anti-parasitic & anti-microbial. You can even clean with it WOW!! (There are times Amazon puts Gaia brand on sale! A real bargin!!!)  It's a natural alternative to prescription antibiotics. Clip off the end of capsule squeeze out the oil in a little shallow cup add a tablespoon or two of a carrier oil (olive oil coconut oil  grape seed oil etc) mix and apply to burns cuts infected areas... etc and Gaia makes a very good capsule! Have a toe fungus a cough you can't shake this will be your go- to! I even use it diluted on my fur baby when he has a hot spot! My life line to health! Quick delivery packaged very good! 😊,5,Can be used topically diffused or taken internally,Greenhatgal54,example@example.com,TRUE
oil-of-oregano,2022-01-07,I bought the one with 120 capsules. It felt lighter than usual so I decided to count them. Three times. There were 119 and the caps are noticeably underfilled. I used to suggest this brand because their quality seems great and their products have worked well for me in the past. Lost a good customer.,3,Underfilling,Amazon_Customer,example@example.com,TRUE
